{
 "schemaVersion": "poc-0.3",
 "audio": {
  "sha256": "a9c2655d8418f5177aa2ea21388b10b7d841b3f118d44073ed709f86e2e0e0f1",
  "durationUs": 8000000,
  "sampleRate": 44100
 },
 "observations": {
  "trackerBeatsUs": [
   412154,
   812698,
   1213243,
   1607982,
   2008526,
   2409070,
   2809615,
   3210159
  ]
 },
 "timing": {
  "bpm": 150.013499999987,
  "beatLengthUs": 399964.00323974306,
  "offsetUs": 401276,
  "source": "detected",
  "manualFields": [],
  "trackerBpm": 149.7961956521739,
  "inlierRatio": 1.0,
  "gridScore": 0.9989868214618149,
  "chanceScore": 0.20412414523193154,
  "alternatives": [
   {
    "bpm": 75.0067499999935,
    "gridScore": 0.3267655360449196
   },
   {
    "bpm": 100.00899999999133,
    "gridScore": 0.09854246215159093
   },
   {
    "bpm": 112.51012499999025,
    "gridScore": 0.21086739265781837
   },
   {
    "bpm": 200.01799999998266,
    "gridScore": 0.09775173526320102
   },
   {
    "bpm": 225.0202499999805,
    "gridScore": 0.3263335885190142
   },
   {
    "bpm": 300.026999999974,
    "gridScore": 0.9959516693594187
   }
  ],
  "confidence": 0.999,
  "confidenceKind": "heuristic"
 },
 "gridDivisor": 4,
 "grid": [
  {
   "index": -4,
   "timeUs": 1312,
   "onset": 0.0589,
   "low": 0.0122,
   "high": 0.0739,
   "energy": 0.8041,
   "sustain": 0.1191,
   "percussive": 0.0471,
   "harmonic": 0.0222,
   "tone": 0.4,
   "toneHeld": 0.0595
  },
  {
   "index": -3,
   "timeUs": 101303,
   "onset": 0.0098,
   "low": 0.0182,
   "high": 0.0006,
   "energy": 0.0574,
   "sustain": 0.184,
   "percussive": 0.0078,
   "harmonic": 0.0002,
   "tone": 0.4,
   "toneHeld": 0.092
  },
  {
   "index": -2,
   "timeUs": 201294,
   "onset": 0.6063,
   "low": 0.065,
   "high": 0.9851,
   "energy": 0.1811,
   "sustain": 0.1795,
   "percussive": 0.485,
   "harmonic": 0.2955,
   "tone": 0.4,
   "toneHeld": 0.0897
  },
  {
   "index": -1,
   "timeUs": 301285,
   "onset": 0.0,
   "low": 0.0,
   "high": 0.0,
   "energy": 0.0002,
   "sustain": 0.1855,
   "percussive": 0.0,
   "harmonic": 0.0,
   "tone": 0.4,
   "toneHeld": 0.0927
  },
  {
   "index": 0,
   "timeUs": 401276,
   "onset": 0.8358,
   "low": 1.1459,
   "high": 0.6954,
   "energy": 0.8938,
   "sustain": 0.1471,
   "percussive": 0.6686,
   "harmonic": 0.2086,
   "tone": 0.4,
   "toneHeld": 0.0736
  },
  {
   "index": 1,
   "timeUs": 501267,
   "onset": 0.2326,
   "low": 0.2899,
   "high": 0.1343,
   "energy": 0.1452,
   "sustain": 0.144,
   "percussive": 0.1861,
   "harmonic": 0.0403,
   "tone": 0.4,
   "toneHeld": 0.072
  },
  {
   "index": 2,
   "timeUs": 601258,
   "onset": 0.6091,
   "low": 0.0646,
   "high": 0.9488,
   "energy": 0.1811,
   "sustain": 0.1385,
   "percussive": 0.4873,
   "harmonic": 0.2846,
   "tone": 0.4,
   "toneHeld": 0.0693
  },
  {
   "index": 3,
   "timeUs": 701249,
   "onset": 0.0,
   "low": 0.0,
   "high": 0.0,
   "energy": 0.0002,
   "sustain": 0.144,
   "percussive": 0.0,
   "harmonic": 0.0,
   "tone": 0.4,
   "toneHeld": 0.072
  },
  {
   "index": 4,
   "timeUs": 801240,
   "onset": 1.4557,
   "low": 1.0564,
   "high": 1.4738,
   "energy": 0.8112,
   "sustain": 0.0976,
   "percussive": 1.1646,
   "harmonic": 0.4421,
   "tone": 0.4,
   "toneHeld": 0.0488
  },
  {
   "index": 5,
   "timeUs": 901231,
   "onset": 0.0115,
   "low": 0.0198,
   "high": 0.0006,
   "energy": 0.055,
   "sustain": 0.0465,
   "percussive": 0.0092,
   "harmonic": 0.0002,
   "tone": 0.4,
   "toneHeld": 0.0232
  },
  {
   "index": 6,
   "timeUs": 1001222,
   "onset": 0.5882,
   "low": 0.0696,
   "high": 0.8833,
   "energy": 0.18,
   "sustain": 0.0578,
   "percussive": 0.4706,
   "harmonic": 0.265,
   "tone": 0.4,
   "toneHeld": 0.0289
  },
  {
   "index": 7,
   "timeUs": 1101213,
   "onset": 0.0,
   "low": 0.0,
   "high": 0.0,
   "energy": 0.0002,
   "sustain": 0.184,
   "percussive": 0.0,
   "harmonic": 0.0,
   "tone": 0.4,
   "toneHeld": 0.092
  },
  {
   "index": 8,
   "timeUs": 1201204,
   "onset": 0.4834,
   "low": 0.0708,
   "high": 0.8584,
   "energy": 0.1809,
   "sustain": 0.1909,
   "percussive": 0.3867,
   "harmonic": 0.2575,
   "tone": 0.4,
   "toneHeld": 0.0954
  },
  {
   "index": 9,
   "timeUs": 1301195,
   "onset": 0.0,
   "low": 0.0,
   "high": 0.0,
   "energy": 0.0002,
   "sustain": 0.2659,
   "percussive": 0.0,
   "harmonic": 0.0,
   "tone": 0.4,
   "toneHeld": 0.133
  },
  {
   "index": 10,
   "timeUs": 1401186,
   "onset": 0.6962,
   "low": 0.9989,
   "high": 0.8137,
   "energy": 0.8794,
   "sustain": 0.226,
   "percussive": 0.557,
   "harmonic": 0.2441,
   "tone": 0.4,
   "toneHeld": 0.113
  },
  {
   "index": 11,
   "timeUs": 1501177,
   "onset": 0.2565,
   "low": 0.252,
   "high": 0.1332,
   "energy": 0.1366,
   "sustain": 0.1464,
   "percussive": 0.2052,
   "harmonic": 0.04,
   "tone": 0.4,
   "toneHeld": 0.0732
  },
  {
   "index": 12,
   "timeUs": 1601168,
   "onset": 1.3179,
   "low": 0.8296,
   "high": 1.4104,
   "energy": 0.8166,
   "sustain": 0.1202,
   "percussive": 1.0543,
   "harmonic": 0.4231,
   "tone": 0.4,
   "toneHeld": 0.0601
  },
  {
   "index": 13,
   "timeUs": 1701159,
   "onset": 0.0116,
   "low": 0.0208,
   "high": 0.0004,
   "energy": 0.052,
   "sustain": 0.1853,
   "percussive": 0.0093,
   "harmonic": 0.0001,
   "tone": 0.4,
   "toneHeld": 0.0926
  },
  {
   "index": 14,
   "timeUs": 1801150,
   "onset": 0.5447,
   "low": 0.0732,
   "high": 0.7542,
   "energy": 0.1803,
   "sustain": 0.181,
   "percussive": 0.4358,
   "harmonic": 0.2263,
   "tone": 0.4,
   "toneHeld": 0.0905
  },
  {
   "index": 15,
   "timeUs": 1901141,
   "onset": 0.0,
   "low": 0.0,
   "high": 0.0,
   "energy": 0.0001,
   "sustain": 0.1883,
   "percussive": 0.0,
   "harmonic": 0.0,
   "tone": 0.4,
   "toneHeld": 0.0941
  },
  {
   "index": 16,
   "timeUs": 2001132,
   "onset": 0.8855,
   "low": 0.6407,
   "high": 0.9787,
   "energy": 0.9268,
   "sustain": 0.1436,
   "percussive": 0.7084,
   "harmonic": 0.2936,
   "tone": 0.4,
   "toneHeld": 0.0718
  },
  {
   "index": 17,
   "timeUs": 2101123,
   "onset": 0.2732,
   "low": 0.2253,
   "high": 0.1467,
   "energy": 0.1374,
   "sustain": 0.1437,
   "percussive": 0.2186,
   "harmonic": 0.044,
   "tone": 0.4,
   "toneHeld": 0.0718
  },
  {
   "index": 18,
   "timeUs": 2201114,
   "onset": 0.5223,
   "low": 0.0731,
   "high": 0.6974,
   "energy": 0.1804,
   "sustain": 0.1384,
   "percussive": 0.4178,
   "harmonic": 0.2092,
   "tone": 0.4,
   "toneHeld": 0.0692
  },
  {
   "index": 19,
   "timeUs": 2301105,
   "onset": 0.0,
   "low": 0.0,
   "high": 0.0,
   "energy": 0.0002,
   "sustain": 0.1438,
   "percussive": 0.0,
   "harmonic": 0.0,
   "tone": 0.4,
   "toneHeld": 0.0719
  },
  {
   "index": 20,
   "timeUs": 2401096,
   "onset": 1.0225,
   "low": 0.5824,
   "high": 1.1205,
   "energy": 0.8201,
   "sustain": 0.094,
   "percussive": 0.818,
   "harmonic": 0.3362,
   "tone": 0.4,
   "toneHeld": 0.047
  },
  {
   "index": 21,
   "timeUs": 2501087,
   "onset": 0.0104,
   "low": 0.02,
   "high": 0.0004,
   "energy": 0.0504,
   "sustain": 0.0463,
   "percussive": 0.0083,
   "harmonic": 0.0001,
   "tone": 0.4,
   "toneHeld": 0.0232
  },
  {
   "index": 22,
   "timeUs": 2601078,
   "onset": 0.5005,
   "low": 0.0727,
   "high": 0.7075,
   "energy": 0.1805,
   "sustain": 0.0614,
   "percussive": 0.4004,
   "harmonic": 0.2122,
   "tone": 0.4,
   "toneHeld": 0.0307
  },
  {
   "index": 23,
   "timeUs": 2701069,
   "onset": 0.0,
   "low": 0.0,
   "high": 0.0,
   "energy": 0.0002,
   "sustain": 0.1838,
   "percussive": 0.0,
   "harmonic": 0.0,
   "tone": 0.4,
   "toneHeld": 0.0919
  },
  {
   "index": 24,
   "timeUs": 2801060,
   "onset": 0.6063,
   "low": 0.0655,
   "high": 0.9387,
   "energy": 0.1811,
   "sustain": 0.1879,
   "percussive": 0.485,
   "harmonic": 0.2816,
   "tone": 0.4,
   "toneHeld": 0.094
  },
  {
   "index": 25,
   "timeUs": 2901051,
   "onset": 0.0,
   "low": 0.0,
   "high": 0.0,
   "energy": 0.0002,
   "sustain": 0.2664,
   "percussive": 0.0,
   "harmonic": 0.0,
   "tone": 0.4,
   "toneHeld": 0.1332
  },
  {
   "index": 26,
   "timeUs": 3001042,
   "onset": 0.9196,
   "low": 1.1848,
   "high": 0.7955,
   "energy": 0.905,
   "sustain": 0.2214,
   "percussive": 0.7357,
   "harmonic": 0.2386,
   "tone": 0.4,
   "toneHeld": 0.1107
  },
  {
   "index": 27,
   "timeUs": 3101033,
   "onset": 0.2534,
   "low": 0.2859,
   "high": 0.1418,
   "energy": 0.1415,
   "sustain": 0.1459,
   "percussive": 0.2027,
   "harmonic": 0.0425,
   "tone": 0.4,
   "toneHeld": 0.073
  },
  {
   "index": 28,
   "timeUs": 3201024,
   "onset": 0.9972,
   "low": 0.7967,
   "high": 0.9705,
   "energy": 0.7965,
   "sustain": 0.1194,
   "percussive": 0.7978,
   "harmonic": 0.2912,
   "tone": 0.4,
   "toneHeld": 0.0597
  },
  {
   "index": 29,
   "timeUs": 3301015,
   "onset": 0.0087,
   "low": 0.0183,
   "high": 0.0006,
   "energy": 0.0492,
   "sustain": 0.1849,
   "percussive": 0.007,
   "harmonic": 0.0002,
   "tone": 0.4,
   "toneHeld": 0.0925
  },
  {
   "index": 30,
   "timeUs": 3401006,
   "onset": 0.4931,
   "low": 0.0705,
   "high": 0.8709,
   "energy": 0.1809,
   "sustain": 0.1794,
   "percussive": 0.3945,
   "harmonic": 0.2613,
   "tone": 0.4,
   "toneHeld": 0.0897
  },
  {
   "index": 31,
   "timeUs": 3500997,
   "onset": 0.0,
   "low": 0.0,
   "high": 0.0,
   "energy": 0.0002,
   "sustain": 0.1851,
   "percussive": 0.0,
   "harmonic": 0.0,
   "tone": 0.4,
   "toneHeld": 0.0925
  }
 ],
 "sections": [
  {
   "startUs": 1312,
   "endUs": 301285,
   "firstBar": -1,
   "barCount": 1,
   "intensity": 0,
   "energy": 0.2607
  },
  {
   "startUs": 401276,
   "endUs": 1901141,
   "firstBar": 0,
   "barCount": 1,
   "intensity": 1,
   "energy": 0.2821
  },
  {
   "startUs": 2001132,
   "endUs": 3500997,
   "firstBar": 1,
   "barCount": 1,
   "intensity": 3,
   "energy": 0.2844
  },
  {
   "startUs": 3600988,
   "endUs": 5100853,
   "firstBar": 2,
   "barCount": 1,
   "intensity": 2,
   "energy": 0.2832
  },
  {
   "startUs": 5200844,
   "endUs": 6700709,
   "firstBar": 3,
   "barCount": 1,
   "intensity": 3,